Topic,Title,Deleted,Media
1,翻转的时光,FALSE,邓安庆
1,怎么写你都不够,FALSE,邓安庆
1,疑似武汉肺炎，居家隔离的第六天,FALSE,兜爷麻麻不睡觉
1,我们在一起做的事情,FALSE,邓安庆
1,一脚一个春天,FALSE,邓安庆
2,隔离前，她们去过4个城市，跟80多人吃过饭,FALSE,冰点周刊
2,记者手记|疫情笼罩纽约，哥伦比亚大学停课两天,FALSE,财新网
2,时疫琐记,FALSE,邓安庆
2,瑞士女议员因戴口罩被赶出议会大厅！如何理解“不戴口罩”的欧洲？,FALSE,中国经营报
2,德国疫情日记⑦：德国人为什么不爱戴口罩？,FALSE,体坛周报
3,回武汉记（六）,FALSE,谈骁
3,回武汉记（五）,FALSE,谈骁
3,UP主实拍：“空城”武汉的物价、交通 、生活状态,FALSE,第一财经
3,封面报道之治理篇|襄阳：最后的出口,FALSE,财新网
3,襄阳：如何成为湖北唯一不“封城”的地级市,FALSE,南方周末/南方人物周刊
4,新增确诊99例，其中境外输入24例,FALSE,澎湃新闻
4,湖北以外新增17例，其中16例来自境外,FALSE,澎湃新闻
4,首次！全国新增治愈出院超过新增确诊,FALSE,澎湃新闻
4,肺炎日记|2月27日：国际疫情继续升级 新增病例首超中国,FALSE,财新网
4,国内出现至少 5 例海外输入病例，世卫组织将疫情等级提至最高，以及其他 20 条疫情新闻,FALSE,所有的鱼
5,有研究探新冠病毒基因演化 疑华南海鲜市场非原始来源,FALSE,财新网
5,华南海鲜市场不是病毒发源地，中科院团队基因追踪“零号病人”再进一步,FALSE,界面新闻
5,华南海鲜市场不是病毒发源地！中科院团队基因追踪“零号病人”再进一步,FALSE,DeepTech深科技
5,气溶胶传播新冠病毒？医学专家提醒尚缺充分研究佐证,FALSE,财经杂志/财经十一人
5,科技部急征快速试剂盒，15分钟检出新冠病毒可靠吗？,FALSE,中国新闻周刊
6,大年三十，父母送我们离开了湖北老家,FALSE,人间theLivings
6,在疫情面前，小镇上的每个人都不一样,FALSE,人间theLivings
6,老公进驻医院后，家门就是我们的鹊桥,FALSE,人间theLivings
6,直到离开家时，我才真切感受到了恐惧,FALSE,人间theLivings
6,武汉的餐饮人：在这个冬天等春天,FALSE,人间theLivings
7,首例新冠危重症患者全肺活检病理报告：肺成了古铜色,FALSE,澎湃新闻
7,刘良团队首份新冠遗体解剖报告来了：和SARS有区别,FALSE,澎湃新闻
7,钟南山领衔最新新冠研究：这些病人风险最高,FALSE,澎湃新闻
7,新冠肺炎遗体解剖已完成11例，死者肺部有黏液性分泌物,FALSE,界面新闻
7,首例新冠遗体解剖结果将公布，手术前这个举动不一般,FALSE,澎湃新闻
8,亲历者讲述：武汉市中心医院医护人员被感染始末,FALSE,中国新闻周刊
8,武汉疫情调查追踪：医护感染应受关注,FALSE,财新网
8,一家 “遍体鳞伤”的武汉三甲医院,FALSE,澎湃新闻
8,武汉同济医院一线医生口述：每天面对死亡，紧张但不恐惧——专访武汉同济医院心内科医生赵金召,FALSE,经济观察报
8,武汉市中心医院医护人员吐真情：疫情是面照妖镜,TRUE,环球时报
9,口述｜ICU男护士“Tony蒋”，曾经也是手残党,FALSE,澎湃新闻
9,“我血管细，你们眼镜都糊了，是不好打针”,FALSE,澎湃新闻
9,抗疫、漫画、追星、拍Vlog……这届90后护士另类又强大,FALSE,澎湃新闻
9,从崩溃到零感染，第一批援助医疗队在黄冈的30天,FALSE,一条
9,世界，我们需要帮助：中国医务人员柳叶刀发文，请求国际医疗支援,TRUE,丁香园
10,通知“严禁讨论疫情、擅自接受采访”，官方回应,FALSE,澎湃新闻
10,办理健康证还要缴费？官方回应：不违规,FALSE,澎湃新闻
10,云南彝良回应150名医务人员放弃抗疫补助,FALSE,界面新闻
10,一线医护补助最低400元，医院领导拿8000元，查！,FALSE,澎湃新闻
10,回武汉救命！在外停药的慢性疾病患者有希望了,FALSE,澎湃新闻
11,瑞德西韦与双黄连试验之比较，尚未起跑已分高下,FALSE,DeepTech深科技
11,医学顶刊首发新冠临床试验结果：中国研究证实克力芝收效甚微，不能降低重症死亡率,FALSE,DeepTech深科技
11,解药|无临床试验结果，院士李兰娟两款新冠荐药数据遭质疑,FALSE,财新网
11,瑞德西韦仿制药量产 专利问题何解,FALSE,经济观察报
11,疫情当前 何以回家：马尼拉中国旅客的漫漫回国路,FALSE,腾讯新闻《潜望》
12,深圳野生动物禁食条例征求意见 这些动物被明确列入禁食黑名单……,FALSE,经济观察报
12,疫情过后还要养殖果子狸? 江西省野保局：不属实，相关政策有待国家进一步明确,FALSE,界面新闻
12,全面禁止非法野生动物交易 专家建议推出可食用动物白名单,FALSE,中国新闻周刊
12,封面调查 | 致命野味，非法盗猎和买卖为何屡禁不止？,FALSE,中国新闻周刊
12,全面禁食？2500万网红竹鼠等待判决,FALSE,界面新闻
13,“万家宴”社区百步亭确诊多例新冠肺炎 一小区55栋楼中33栋有发热病人,FALSE,经济观察报
13,上级压力大，居民不理解，基层干部难难难,FALSE,南风窗
13,武汉大爷：我只要草纸，就别捆绑卫生巾了吧,FALSE,南风窗
13,万家宴后的百步亭,FALSE,经济观察报
13,“武汉嫂子汉骂”火了后，成了社区志愿者,FALSE,澎湃新闻
14,团购群成了江湖，武汉人练就一身武功,FALSE,优良better
14,他们开始为“新冠疫情”的医生制作游戏,FALSE,机核网
14,行思路 | “我们爱我们的邻居”——口罩哨兵,FALSE,A2N疫情志愿组
14,A2N内部访谈 | 范老师：这也是我的事，我能做什么吗？,FALSE,A2N疫情志愿组
14,A2N内部访谈 | 陈知白，微光与炬火，怯懦与勇气,FALSE,A2N疫情志愿组
15,我在湖北艾滋患者求助热线接电话,FALSE,极昼工作室
15,疫情中的故事——困于大海，无药求生,FALSE,白桦林健康资讯
15,无声的战“疫”：武汉城内的聋哑人,FALSE,剥洋葱people
15,一场为女性发起的「战疫」,FALSE,人物/每日人物
15,断药危机：封城封村之后的艾滋感染者,FALSE,人物/每日人物
16,北林散文诗集-预警全球灾疫处于爆发前夕,FALSE,北纬三十七点度森林里有片芦苇荡
16,志愿者 | 我有点扛不住了,FALSE,北纬三十七点度森林里有片芦苇荡
16,【抗击新型肺炎自救】第二天,FALSE,北纬三十七点度森林里有片芦苇荡
16,【抗击新型肺炎自救】第一天,FALSE,北纬三十七点度森林里有片芦苇荡
16,【抗击新型肺炎自救】第三天,FALSE,北纬三十七点度森林里有片芦苇荡
17,捐赠物资“直达”武汉目标医院的另类样本：百万粉丝博主倒逼物流改变收件目的地,FALSE,经济观察报
17,校友会的战“疫”网：医疗物资补位者的进与退,FALSE,南方周末/南方人物周刊
17,意大利温州商人的捐赠神通：捐物资，也捐物流｜疫中人⑩,FALSE,界面新闻
17,意大利温商的“闯关”之旅：海外个人捐赠为何如此难？,FALSE,界面新闻
17,武汉物资紧缺，民间力量把援助送进医院到底有多难？,FALSE,八点健闻
18,叶青：武汉出“硬招”了！,FALSE,叶青
18,中央指导组成员向疫情逝者默哀,FALSE,澎湃新闻
18,叶青：要跻身一流城市，武汉不能再有“瞎指挥”,FALSE,叶青
18,叶青：武汉30天，有件遗憾的事,FALSE,叶青
18,叶青：新冠肺炎与官僚主义一起反，才是正确选择,FALSE,叶青
19,新冠肺炎疫情大事记（上篇）,FALSE,财经杂志/财经十一人
19,新冠肺炎疫情大事记（中篇）,FALSE,财经杂志/财经十一人
19,数说疫情0206：拐点渐近,FALSE,财经杂志/财经十一人
19,数说疫情0215：非湖北地区新增病例5日后有望清零，湖北进入总攻阶段,FALSE,财经杂志/财经十一人
19,数说疫情0209：洪峰通过，见“顶”可期,FALSE,财经杂志/财经十一人
20,压力太大，有援鄂医护整宿失眠,FALSE,澎湃新闻
20,疫情中的心理援助：寻找局部的安全,FALSE,GQ报道
20,湖北一线心理咨询师：恐慌让他每半个小时测一次体温,FALSE,北青深一度
20,恐慌、焦虑、绝望……疫情之下，你还需要心理防护,FALSE,燃财经
20,“抗疫”的第二战线：有人整晚睡不着，有人远程提供紧急心理包扎,FALSE,人间像素
21,美国CDC前主任：一而再地，我们都在恐慌和忽视中循环,FALSE,中国新闻周刊
21,李铁：疫情较轻的城市应及时复工开业,FALSE,财经杂志/财经十一人
21,抗疫国际合作，习近平的“怎么做”和“为什么”,FALSE,中国新闻周刊
21,20多国紧急状态，中国如何帮助抗疫？,FALSE,财经杂志/财经十一人
21,新冠疫情考验全球治理,FALSE,中国新闻周刊
22,疫情放大三星危机，越南基地缺人缺料缺协同,FALSE,财经杂志/财经十一人
22,疫情放大三星供应链危机，越南基地缺人缺料缺协同,FALSE,财经杂志/财经十一人
22,疫情严峻手机还得卖，3999元的小米10能否突围？,FALSE,界面新闻
22,口罩“心脏”熔喷布这么缺，为什么厂商不借机上产线、扩产能？,FALSE,界面新闻
22,“我有口罩机却没有熔喷布”，口罩“心脏”价格从2万涨到8万,FALSE,界面新闻
23,武汉一方舱医院发布紧急通知：拟出院病友需加做病毒抗体检查,FALSE,澎湃新闻
23,44名痊愈者26人复阳，专家建议出院标准要严，上海要查肛拭子,FALSE,中国新闻周刊
23,广东14%出院患者复检阳性，专家：可能仍具传染性,FALSE,中国新闻周刊
23,女子从武汉回来21天后无发热症状，第4次才确诊,FALSE,澎湃新闻
23,武汉政策加码：出院后还要集中隔离2周，新冠肺炎怎样才算治愈？,FALSE,八点健闻
24,封城十三天后：防疫时期的武汉玩家,FALSE,机核网
24,口述实录 | 如果没有这场疫情，这一天是我穿上秀禾服结婚的日子,FALSE,世间有味
24,武汉的除夕夜，我一个人在家自行观察,FALSE,在人间living
24,武汉的年夜饭：从来没有这么简单，从来没有这么重要,FALSE,新周刊
24,疫情风暴眼中的武汉居民生活,FALSE,南都周刊
25,口述实录：奶奶，是你在天上保佑我们吧 | 武汉武汉,FALSE,中央广电总台中国之声
25,口述实录：大连小伙儿小强的武汉奇遇 | 武汉武汉,FALSE,中央广电总台中国之声
25,口述实录：心怀恐惧，依然前行 | 武汉武汉,FALSE,中央广电总台中国之声
25,这个春节，我在北京送外卖,FALSE,触乐网
25,口述实录：我记录的，是这个城市历史的一部分 | 武汉武汉,FALSE,中央广电总台中国之声
26,奥运会可能变成冬奥会？ 日本奥运大臣：东京奥运会或推迟至年底举行,FALSE,中国经营报
26,追踪钻石公主号：邮轮上有两名内地乘客，一人已确诊,FALSE,财经杂志/财经十一人
26,又一邮轮被新冠肺炎疫情笼罩！乘客：像在“豪华监狱”,FALSE,中国经营报
26,挪威奥委会向国际奥委会建议推迟东京奥运会,FALSE,界面新闻
26,“钻石公主”号今日再下600人，各国接回后将继续隔离14天,FALSE,界面新闻
27,湖北17岁脑瘫儿死亡前一天，父亲多次拨打120和110求助无果,FALSE,大米和小米
27,家人疑似新冠肺炎被隔离，湖北17岁脑瘫儿独自在家6天后死亡,FALSE,大米和小米
27,黄冈死亡脑瘫儿父亲：隔离7天，收到孩子火化委托书,TRUE,真实故事计划
27,湖北脑瘫儿之死：多方曾介入救助 父亲被隔离时想带其入院,FALSE,清流工作室
27,疫情中一夜长大的少年,FALSE,在人间living
28,海底捞恢复营业的第一天，客人少得有点可怜,FALSE,界面新闻
28,广东餐饮业恢复堂食第一天：陶陶居被紧急叫停，极少数餐厅开放接待,FALSE,界面新闻
28,八合里海记牛肉火锅老板：月亏6000万，考虑卖房发工资,FALSE,界面新闻
28,香港四大核心商区空置商铺半年激增近一倍，尖沙咀最惨,FALSE,界面新闻
28,自如被指坐地起价，强制湖北籍租客隔离期间换房,FALSE,中国新闻周刊
29,谁也想不到，这个春节最该储备的年货是口罩,FALSE,三明治
29,封城第十五天，“今天也是，体温正常” | 三明治武汉每日书 12,FALSE,三明治
29,生活还要继续，但如果没有菜了…… ｜三明治武汉每日书13,FALSE,三明治
29,武汉城内，我家报名了社区网格员志愿服务｜三明治武汉每日书14,FALSE,三明治
29,预产期还有6天，我在武汉待产的医院被征用 | 武汉日常每日书05,FALSE,三明治
30,鄂M卡车的归乡之路,FALSE,剥洋葱people
30,死去的蜜蜂，未卜的追花路和无助的养蜂人,FALSE,界面新闻
30,养蜂人刘德成，无法再追花,FALSE,人物/每日人物
30,“千里逆行”送菜进鄂：执勤民警道谢不握手，司机称“这一趟跑得值！”,FALSE,北青深一度
30,疫区救援，我在武汉修汽车,FALSE,真实故事计划
31,李文亮医生的最后40天,FALSE,财经杂志/财经十一人
31,记者回忆与李文亮的对话：他自称是个小医生,FALSE,南方都市报
31,李文亮，没等到庆余年2,FALSE,澎湃新闻
31,国家监委调查组发布李文亮有关情况调查通报,FALSE,财新网
31,李文亮有关情况调查结果公布,FALSE,中国新闻周刊
32,上海劝返无居住地入沪者，即使后备箱也严查,FALSE,界面新闻
32,藏在后备箱里进上海，居然成真了！,FALSE,澎湃新闻
32,复工第二周，记者走访上海地铁公交出租车，市内公共交通安全吗？,FALSE,新民周刊
32,一名外国人入境上海，需要过哪些关？,FALSE,澎湃新闻
32,疫情防控下，返岗北上广图景,FALSE,极昼工作室
33,中科创星米磊：疫情和新基建，正在推动自动驾驶爆发,FALSE,燃财经
33,新石器余恩源：送快递、送外卖，无人车正在加速替代人类,FALSE,燃财经
33,朱啸虎：创业企业不要倒在疫情结束后的“倒春寒”,FALSE,燃财经
33,后疫情时代，数字化能拯救企业吗,FALSE,财经杂志/财经十一人
33,快仓智能孙宇：疫情加速机器人应用，但无人车无人机送货还很远,FALSE,燃财经
34,艺术类校考延期，艺培机构在找出路,FALSE,界面新闻
34,当穷孩子也开始上网课,FALSE,真实故事计划
34,目前大规模线上教学效果如何？我们做了个调查,FALSE,澎湃新闻
34,“停课不停学”第一周，老师战网络，家长做噩梦,FALSE,南都周刊
34,“不想上网课，老师变主播”网课首日遭遇花式吐槽到底怎么了？,FALSE,经济观察报
35,贝壳：若无二手房交易，七成中介撑不过半年,FALSE,界面新闻
35,房企打响现金流“保卫战”,FALSE,中国经营报
35,售楼处关闭怎么办？房企这样“战疫”,FALSE,南都周刊
35,疫情之下，海天味业们高估值“神话”还能持续吗？,FALSE,界面新闻
35,全民宅家，疫情如何影响中国食品饮料消费市场？,FALSE,财经杂志/财经十一人
36,美联储的王炸加剧恐慌，只有疫苗才能拯救全球金融市场,FALSE,中国经营报
36,昨日ICU，今日KTV！暴跌暴涨后，全球金融市场何去何从？,FALSE,中国经营报
36,美股度过金融危机以来最黑暗一周，美联储表态,FALSE,澎湃新闻
36,美股又熔断！10天4次，巴菲特：…,FALSE,中国经营报
36,华尔街陷疫：全球大萧条的第一声警报？|《财经》封面,FALSE,财经杂志/财经十一人
37,池莉：五十分之一，典型的一天,FALSE,夜光杯
37,胡展奋：中国最早口罩小考,FALSE,夜光杯
37,池莉：对不起，添麻烦了！,FALSE,夜光杯
37,龚静：宅相碎片,FALSE,夜光杯
37,孔明珠：我从沿街的窗户望出去,FALSE,夜光杯
38,爷爷，多希望你永远学不会用智能手机,FALSE,我们是有故事的人
38,在小区防疫的同性恋志愿者,FALSE,GS乐点
38,一通武汉方舱来的电话 ：我要去火神山救我外婆,FALSE,故事FM
38,疫情开始前，我想接父母来北京｜北漂家政女工,FALSE,尖椒部落
38,我不是病毒，我在巴黎街头与50位陌生人拥抱,FALSE,在人间living
39,不明原因肺炎忽现,FALSE,财新网
39,从“未见明显人传人”到“人传人”，复盘武汉疫情二十天,FALSE,第一财经
39,武汉新增病例0增长的12天，发生了什么？,FALSE,第一财经
39,武汉确认27例不明原因肺炎是病毒性肺炎，不确定是SARS,FALSE,八点健闻
39,研究发现：华南海鲜市场并非新冠病毒发源地,FALSE,澎湃新闻
40,这个6岁上海小囡，用画笔成为战疫后方“小记者”！,FALSE,新民周刊
40,毕淑敏：生死之外，人生都是小事,FALSE,新民周刊
40,专访精神科专家谢斌教授，如何化解疫情带来的焦虑？,FALSE,新民周刊
40,独家 | 林青霞致前线抗疫英雄亲笔信背后的故事,FALSE,新民周刊
40,快递小哥汪勇感动了全国，却有人在利用他的事迹大肆敛财,FALSE,新民周刊
41,2596名死者留下的遗憾，6位一线医生讲述新冠重症治疗难题,FALSE,八点健闻
41,「我在和死神抢病人」｜对话援鄂ICU医生李圣青,FALSE,人物/每日人物
41,双肺全白，通宵抢救！我的病人，生命现在以小时计,FALSE,海上柳叶刀
41,这是武汉“疫”线最真实的抢救实况 | 一只脚踏进鬼门关，被我们硬生生拽回来！,FALSE,海上柳叶刀
41,终极一战：与死神抢人,FALSE,南方周末/南方人物周刊
42,特别报道 | 疾控中心无辜吗？,FALSE,第一财经
42,武汉早期疫情上报为何一度中断,FALSE,冰点周刊
42,传染病网络直报系统投资了7.3亿，为何失灵了28天？,FALSE,财经杂志/财经十一人
42,名实不副地位太低——你可能不知道的中国疾控往事,FALSE,八点健闻
42,武汉疫情初期，网络直报系统为何失灵？,TRUE,剥洋葱people
43,疫情总动员，各地怎么做|北京进一步严防，天津暂停清明祭扫,FALSE,财新网
43,疫情总动员，各地怎么做|保交通、重问责、迟开学,FALSE,财新网
43,“湖北疫情依旧严峻，坚决不能放松”,FALSE,澎湃新闻
43,疫情总动员，各地怎么做|多地严防境外输入 湖北探索复产复工,FALSE,财新网
43,武汉监所一日新增232例 累计确诊806例,FALSE,财新网
44,图说｜和其他传染病相比，新冠病毒肺炎处于什么水平,FALSE,八点健闻
44,对话美国流行病学家：未发现的新冠感染者对我们意味着什么？,FALSE,人物/每日人物
44,十问杨功焕：新冠病毒很可能与人类长期共生,FALSE,财经杂志/财经十一人
44,隔离14天是多还是少？要用统计学来思考,FALSE,界面新闻
44,钟南山团队研究：若早5天干预，疫情减轻过半,FALSE,财新网
45,买菜群里的湖北人：半个土豆给猫半个土豆给自己,FALSE,人物/每日人物
45,DC杂记 | 不完全疫时囤货指南,FALSE,RatherLtd
45,疫情日记 | 武汉封城的第三十四天,FALSE,PlantifulSoul
45,哀乐拼团,FALSE,艾老师工作室
45,疫情日记 | 武汉封城的第二十八天,FALSE,PlantifulSoul
46,“京郊草莓第一镇”自救记,FALSE,棱镜
46,把5G设备运进火神山！驰援武汉背后的物流链紧急重构,FALSE,棱镜
46,“每只利润四五厘”，中国口罩产业17年沉浮,FALSE,棱镜
46,为“火雷神山”工人发工资：开工第一天，5000万工程款就下来了,FALSE,棱镜
46,轻症患者家属自述：冠状病毒肺炎很可恨，但没那么可怕,FALSE,棱镜
47,“平安归来，做我的最美新娘”,FALSE,澎湃新闻
47,北京隔离点入住者：除了不能出门，和住酒店没什么区别,FALSE,新京报
47,“爸爸妈妈是医生，现在他们在抗疫前线”,FALSE,南都周刊
47,我在武汉代喂宠物：它们死了，主人会伤心的,FALSE,澎湃新闻
47,留学韩国的中国学生：为什么我选择回国,FALSE,澎湃新闻
48,专访余永定：中国经济如何做好逆周期调控？,FALSE,财经杂志/财经十一人
48,疫情过后，该启动新一轮经济刺激计划吗？,FALSE,财经杂志/财经十一人
48,连平：中国经济或现小V型反弹，楼市政策应告别“一刀切”,FALSE,界面新闻
48,新冠疫情四重冲击，全球化要倒退？,FALSE,财经杂志/财经十一人
48,中国经济活动预计4月逐步恢复正常，疫情之后如何刺激各行业,FALSE,财经杂志/财经十一人
49,疫情下的深呼吸 | 我们也不知道该怎么办，只能等了,FALSE,协作者云社工
49,疫情下的深呼吸 | 希望他可以成为对社会有用的人,FALSE,协作者云社工
49,疫情下的深呼吸 | 希望能让孩子有个好一点的未来,FALSE,协作者云社工
49,疫情下的深呼吸 | 我还好，只要不生病就行,FALSE,协作者云社工
49,疫情下的深呼吸 | 我想把孩子带在身边,FALSE,协作者云社工
50,未来两周德黑兰会有40%居民感染？伊朗议员呼吁升级“封闭隔离”,FALSE,界面新闻
50,伊朗疫情排查1400万人，两处什叶派圣陵破天荒关闭,FALSE,界面新闻
50,伊朗新冠肺炎患者死亡人数达到6人，28人被确诊,FALSE,界面新闻
50,伊朗副总统确诊感染新冠病毒,FALSE,界面新闻
50,确诊逼近6000！伊朗拟“动武”管制交通，一名新晋女议员病逝,FALSE,界面新闻
51,直面史上最难春招：我的简历无处可去,FALSE,锌财经
51,史上最大规模在家办公开始：孩子是最大障碍 频繁拉群是常态,FALSE,腾讯新闻《潜望》
51,超八成医务人员近期收入下降，8 大科室竞争激烈：疫情下的医疗春招,FALSE,丁香园
51,疫情之下 ，中国科技公司在线办公百态,FALSE,腾讯深网
51,深圳复工抢人大战：时薪加5块，速度要快,FALSE,界面新闻
52,疫情之下，巨灾风险治理如何进化？,FALSE,财经杂志/财经十一人
52,王振耀：疫情前所未见，需要跨部门协调响应，也要避免叠床架屋,FALSE,财经杂志/财经十一人
52,王宏伟：如何应对灾难复杂化新趋势？,FALSE,财经杂志/财经十一人
52,黄某英如何离汉进京的？官方公布调查结果,FALSE,中国新闻周刊
52,司法部牵头的联合调查组公布“女子离汉抵京事件”调查结果,FALSE,界面新闻
53,皇马全队开始隔离，西甲西乙联赛至少暂停两轮,FALSE,界面新闻
53,利用“封城”时间差，米兰人“大逃离”,FALSE,澎湃新闻
53,NBA战疫进入生死时刻 8小时紧急状态连升三级,FALSE,腾讯体育
53,NBA想空场比赛，但需面对每场2000万门票损失和众球星反对,FALSE,界面新闻
53,米兰、威尼斯封城！意大利“战疫”升级军队待命,FALSE,界面新闻
54,不管你爱与不爱都是历史的尘埃,FALSE,人是最美的风景
54,抓一把阳光,FALSE,人是最美的风景
54,回武汉记（上）,FALSE,谈骁
54,生活的刺,FALSE,人是最美的风景
54,谈骁：回武汉记（中）,FALSE,谈骁
55,研究：酶切位点插入事件非独有 新冠病毒源于自然重组,FALSE,财新网
55,疫苗设计新进展！新冠病毒S蛋白超清结构图绘制成功，但实用疫苗还需要更多时间,FALSE,DeepTech深科技
55,新冠疫苗研发大赛正酣，不同技术路线究竟谁更有戏？,FALSE,中国新闻周刊
55,封面报道上篇|看清病毒的样子,FALSE,财新网
55,冷冻电镜下的新冠病毒“侦查战”，西湖大学团队重要病毒解析登Science丨独家专访,FALSE,DeepTech深科技
56,返岗复工农民工已达7800万，卫健委：未要求返岗前开具健康证明,FALSE,界面新闻
56,为达标复工率，浙江部分企业注水用电量,TRUE,财经杂志/财经十一人
56,包飞机发补贴！多地“抢人式”复工,FALSE,澎湃新闻
56,开灯开空调开机器“冲指标” 全国复工数据有多少水分？,TRUE,财新网
56,困境与自救：疫情之下多地“包飞机、包高铁、包车”帮助企业复工,FALSE,新京报
57,特朗普不担心感染，“其实是装的”,FALSE,澎湃新闻
57,美国副总统、国务卿参加的会议，已有2人确诊,FALSE,澎湃新闻
57,特朗普就疫情发表讲话，宣布多项措施,FALSE,澎湃新闻
57,新冠疫情蔓延全美，特朗普连任增变数,FALSE,财经杂志/财经十一人
57,美国两名议员宣布自我隔离,FALSE,澎湃新闻
58,疯狂的假口罩：药店也售假 募捐给武汉医院的物资现三无产品,FALSE,清流工作室
58,超200万只假飘安口罩流入市场，涉事“黑”作坊被查,FALSE,新京报
58,“被消失”的口罩：谁掀翻了边境线上的百万生意,FALSE,财经杂志/财经十一人
58,“被消失”的口罩：谁掀翻了边境线上的百万生意？,FALSE,财经杂志/财经十一人
58,一“枪”难求，买额温枪遭遇连环涨,FALSE,南都周刊
59,武汉最大的方舱医院，关门大吉！,FALSE,澎湃新闻
59,倒计时！武汉投用的方舱医院将全部休舱,FALSE,澎湃新闻
59,方舱医院里“跳舞姐”越来越多，但仍缺心理医生,FALSE,澎湃新闻
59,武汉可以从非典的经验中学到什么？,FALSE,第一财经
59,武汉10万床位待命：从居家隔离到集中隔离的艰难纠偏,FALSE,八点健闻
60,泉州楼祸,FALSE,中国经营报
60,她们在战疫：有人一月没见孩子，有人奔袭500公里回武汉,FALSE,三联生活周刊
60,泉州隔离酒店坍塌：被忽视的结构风险,FALSE,三联生活周刊
60,追问泉州坍塌酒店：装修改造是否违规？为何成为疫情隔离点？,FALSE,财经杂志/财经十一人
